{
  "hostname": "DESKTOP-I8OVKMA",
  "os": "windows",
  "os_version": "Windows 11 Professional",
  "kernel": "10.0.26200",
  "agent_version": "0.1.0",
  "scanned_at": "2026-07-12T06:36:29Z",
  "uptime_seconds": 8139,
  "ip_address": "172.21.0.1",
  "findings": [
    {
      "category": "ai_ide",
      "name": "cursor",
      "severity": "medium",
      "status": "detected",
      "evidence": "Cursor installation found: C:\\Users\\ASUS Vivobook\\AppData\\Roaming\\Cursor",
      "path": "C:\\Users\\ASUS Vivobook\\AppData\\Roaming\\Cursor",
      "user": "ASUS Vivobook",
      "detected_at": "2026-07-12T06:36:29Z"
    },
    {
      "category": "mcp_server",
      "name": "mcp_config",
      "severity": "high",
      "status": "detected",
      "evidence": "MCP config found: C:\\Users\\ASUS Vivobook\\AppData\\Roaming\\Claude\\claude_desktop_config.json (2 server(s) configured)",
      "path": "C:\\Users\\ASUS Vivobook\\AppData\\Roaming\\Claude\\claude_desktop_config.json",
      "user": "ASUS Vivobook",
      "detected_at": "2026-07-12T06:36:29Z"
    },
    {
      "category": "mcp_server",
      "name": "mcp_config",
      "severity": "high",
      "status": "detected",
      "evidence": "MCP config found: C:\\Users\\ASUS Vivobook\\.cursor\\mcp.json (1 server(s) configured)",
      "path": "C:\\Users\\ASUS Vivobook\\.cursor\\mcp.json",
      "user": "ASUS Vivobook",
      "detected_at": "2026-07-12T06:36:29Z"
    }
  ]
}